{
  "$schema": "https://json-schema.org/draft/2020-12/schema",
  "$id": "https://argus.dev/contracts/kernel/v1/kernel.schema.json",
  "title": "KernelFixture",
  "description": "Conformance document for Argus shared identity, evidence, validation, and compatibility values.",
  "type": "object",
  "additionalProperties": false,
  "required": [
    "schemaVersion",
    "contractsVersion",
    "repository",
    "revision",
    "component",
    "capability",
    "suite",
    "test",
    "evidence",
    "compatibility",
    "exampleValidationError"
  ],
  "properties": {
    "schemaVersion": {
      "const": 1
    },
    "contractsVersion": {
      "$ref": "#/$defs/SemanticVersion"
    },
    "repository": {
      "$ref": "#/$defs/RepositoryIdentity"
    },
    "revision": {
      "$ref": "#/$defs/RevisionIdentity"
    },
    "component": {
      "$ref": "#/$defs/ComponentIdentity"
    },
    "capability": {
      "$ref": "#/$defs/CapabilityIdentity"
    },
    "suite": {
      "$ref": "#/$defs/SuiteIdentity"
    },
    "test": {
      "$ref": "#/$defs/TestIdentity"
    },
    "evidence": {
      "$ref": "#/$defs/EvidenceMetadata"
    },
    "compatibility": {
      "$ref": "#/$defs/CompatibilityMetadata"
    },
    "exampleValidationError": {
      "$ref": "#/$defs/ValidationError"
    }
  },
  "$defs": {
    "SemanticVersion": {
      "title": "SemanticVersion",
      "type": "string",
      "pattern": "^(0|[1-9][0-9]*)\\.(0|[1-9][0-9]*)\\.(0|[1-9][0-9]*)(?:-[0-9A-Za-z-]+(?:\\.[0-9A-Za-z-]+)*)?(?:\\+[0-9A-Za-z-]+(?:\\.[0-9A-Za-z-]+)*)?$"
    },
    "RepositoryID": {
      "title": "RepositoryID",
      "description": "Stable repository identity independent of a local checkout path.",
      "type": "string",
      "minLength": 8,
      "maxLength": 255,
      "pattern": "^repo:[a-z0-9][a-z0-9._-]*(?:/[a-z0-9][a-z0-9._-]*)+$"
    },
    "ComponentID": {
      "title": "ComponentID",
      "type": "string",
      "minLength": 11,
      "maxLength": 255,
      "pattern": "^component:[a-z0-9][a-z0-9._/-]*$"
    },
    "CapabilityID": {
      "title": "CapabilityID",
      "type": "string",
      "minLength": 12,
      "maxLength": 255,
      "pattern": "^capability:[a-z0-9][a-z0-9._/-]*$"
    },
    "SuiteID": {
      "title": "SuiteID",
      "type": "string",
      "minLength": 7,
      "maxLength": 255,
      "pattern": "^suite:[a-z0-9][a-z0-9._/-]*$"
    },
    "TestID": {
      "title": "TestID",
      "description": "Stable test identity that does not depend on execution order.",
      "type": "string",
      "minLength": 7,
      "maxLength": 512,
      "pattern": "^test:[a-z0-9][a-z0-9._/:-]*$"
    },
    "RepositoryIdentity": {
      "title": "RepositoryIdentity",
      "type": "object",
      "additionalProperties": false,
      "required": ["id", "provider", "locator"],
      "properties": {
        "id": {
          "$ref": "#/$defs/RepositoryID"
        },
        "provider": {
          "type": "string",
          "enum": ["github", "gitlab", "azure-devops", "other"]
        },
        "locator": {
          "type": "string",
          "format": "uri",
          "pattern": "^https://"
        }
      }
    },
    "RevisionIdentity": {
      "title": "RevisionIdentity",
      "type": "object",
      "additionalProperties": false,
      "required": ["repositoryId", "algorithm", "value"],
      "properties": {
        "repositoryId": {
          "$ref": "#/$defs/RepositoryID"
        },
        "algorithm": {
          "type": "string",
          "const": "git-sha1"
        },
        "value": {
          "type": "string",
          "pattern": "^[0-9a-f]{40}$"
        }
      }
    },
    "ComponentIdentity": {
      "title": "ComponentIdentity",
      "type": "object",
      "additionalProperties": false,
      "required": ["id", "repositoryId"],
      "properties": {
        "id": {
          "$ref": "#/$defs/ComponentID"
        },
        "repositoryId": {
          "$ref": "#/$defs/RepositoryID"
        }
      }
    },
    "CapabilityIdentity": {
      "title": "CapabilityIdentity",
      "type": "object",
      "additionalProperties": false,
      "required": ["id"],
      "properties": {
        "id": {
          "$ref": "#/$defs/CapabilityID"
        }
      }
    },
    "SuiteIdentity": {
      "title": "SuiteIdentity",
      "type": "object",
      "additionalProperties": false,
      "required": ["id", "repositoryId"],
      "properties": {
        "id": {
          "$ref": "#/$defs/SuiteID"
        },
        "repositoryId": {
          "$ref": "#/$defs/RepositoryID"
        }
      }
    },
    "TestIdentity": {
      "title": "TestIdentity",
      "type": "object",
      "additionalProperties": false,
      "required": ["id", "suiteId"],
      "properties": {
        "id": {
          "$ref": "#/$defs/TestID"
        },
        "suiteId": {
          "$ref": "#/$defs/SuiteID"
        }
      }
    },
    "ProducerIdentity": {
      "title": "ProducerIdentity",
      "type": "object",
      "additionalProperties": false,
      "required": ["name", "version"],
      "properties": {
        "name": {
          "type": "string",
          "minLength": 2,
          "maxLength": 63,
          "pattern": "^[a-z][a-z0-9.-]*$"
        },
        "version": {
          "$ref": "#/$defs/SemanticVersion"
        }
      }
    },
    "Provenance": {
      "title": "Provenance",
      "type": "object",
      "additionalProperties": false,
      "required": ["producer", "method", "repositoryId", "revision"],
      "properties": {
        "producer": {
          "$ref": "#/$defs/ProducerIdentity"
        },
        "method": {
          "type": "string",
          "enum": ["explicit", "static-analysis", "dynamic-observation", "historical", "reviewer-confirmed"]
        },
        "repositoryId": {
          "$ref": "#/$defs/RepositoryID"
        },
        "revision": {
          "type": "string",
          "pattern": "^[0-9a-f]{40}$"
        }
      }
    },
    "Confidence": {
      "title": "Confidence",
      "type": "object",
      "additionalProperties": false,
      "required": ["basis", "score", "rationale"],
      "properties": {
        "basis": {
          "type": "string",
          "enum": ["deterministic", "measured", "inferred"]
        },
        "score": {
          "type": "number",
          "minimum": 0,
          "maximum": 1
        },
        "rationale": {
          "type": "string",
          "minLength": 1,
          "maxLength": 1024
        }
      }
    },
    "EvidenceMetadata": {
      "title": "EvidenceMetadata",
      "type": "object",
      "additionalProperties": false,
      "required": ["provenance", "confidence", "observedAt", "expiresAt"],
      "properties": {
        "provenance": {
          "$ref": "#/$defs/Provenance"
        },
        "confidence": {
          "$ref": "#/$defs/Confidence"
        },
        "observedAt": {
          "type": "string",
          "format": "date-time"
        },
        "expiresAt": {
          "description": "Expiry instant, or null when policy declares the evidence non-expiring.",
          "type": ["string", "null"],
          "format": "date-time"
        }
      }
    },
    "CompatibilityMetadata": {
      "title": "CompatibilityMetadata",
      "type": "object",
      "additionalProperties": false,
      "required": ["contract", "schemaVersion", "bundleVersion", "minimumReaderBundleVersion"],
      "properties": {
        "contract": {
          "type": "string",
          "const": "kernel/v1"
        },
        "schemaVersion": {
          "const": 1
        },
        "bundleVersion": {
          "$ref": "#/$defs/SemanticVersion"
        },
        "minimumReaderBundleVersion": {
          "$ref": "#/$defs/SemanticVersion"
        }
      }
    },
    "ValidationError": {
      "title": "ValidationError",
      "type": "object",
      "additionalProperties": false,
      "required": ["code", "path", "message"],
      "properties": {
        "code": {
          "type": "string",
          "enum": ["invalid-format", "missing-required", "unknown-field", "unsupported-version", "invariant-violation"]
        },
        "path": {
          "description": "RFC 6901 JSON Pointer to the invalid value; empty means the document root.",
          "type": "string",
          "pattern": "^(?:/(?:[^~/]|~0|~1)*)*$"
        },
        "message": {
          "type": "string",
          "minLength": 1,
          "maxLength": 1024
        }
      }
    }
  }
}
