{
  "schemaVersion": 1,
  "contractsVersion": "0.1.0",
  "repository": {
    "id": "repo:github.com/example/orders",
    "provider": "github",
    "locator": "https://github.com/example/orders"
  },
  "revision": {
    "repositoryId": "repo:github.com/example/orders",
    "algorithm": "git-sha1",
    "value": "0123456789abcdef0123456789abcdef01234567"
  },
  "component": {
    "id": "component:orders-api",
    "repositoryId": "repo:github.com/example/orders"
  },
  "capability": {
    "id": "capability:checkout/create-order"
  },
  "suite": {
    "id": "suite:orders-api-contract",
    "repositoryId": "repo:github.com/example/orders-tests"
  },
  "test": {
    "id": "test:orders-api-contract:create-order-valid",
    "suiteId": "suite:orders-api-contract"
  },
  "evidence": {
    "provenance": {
      "producer": {
        "name": "argus-catalog",
        "version": "0.1.0"
      },
      "method": "explicit",
      "repositoryId": "repo:github.com/example/orders",
      "revision": "0123456789abcdef0123456789abcdef01234567"
    },
    "confidence": {
      "basis": "deterministic",
      "score": 1,
      "rationale": "The repository descriptor declares the mapping explicitly."
    },
    "observedAt": "2026-09-16T12:00:00Z",
    "expiresAt": null
  },
  "compatibility": {
    "contract": "kernel/v1",
    "schemaVersion": 1,
    "bundleVersion": "0.1.0",
    "minimumReaderBundleVersion": "0.1.0"
  },
  "exampleValidationError": {
    "code": "invalid-format",
    "path": "/revision/value",
    "message": "revision must be a lowercase 40-character Git SHA-1"
  }
}
